<!ELEMENT Magacin (Artikal)+>

<!ELEMENT Artikal (Naziv,DatumIzrade,Cena,KompanijaProdavca,(Email)+)>

<!ELEMENT Naziv (#PCDATA)>

<!ELEMENT DatumIzrade (Dan,Mesec,Godina)>
<!ELEMENT Dan (#PCDATA)>
<!ELEMENT Mesec (#PCDATA)>
<!ELEMENT Godina (#PCDATA)>

<!ELEMENT Cena (#PCDATA)>
<!ATTLIST Cena tip (dinari|euri) "dinari">

<!ELEMENT KompanijaProdavca (ImeKompanije,Adresa)>
<!ELEMENT ImeKompanije (#PCDATA)>
<!ELEMENT Adresa (#PCDATA)>

<!ELEMENT Email (#PCDATA)>
<!ATTLIST Email tip (privatni|sluzbeni) #REQUIRED>